{
  "slug": "houshang-flowers",
  "theme": "default",
  "domain": "houshang-flowers.com",
  "siteUrl": "https://houshang-flowers.com",
  "name": {
    "fa": "مجتمع گل و گیاه هوشنگ",
    "en": "Houshang Flowers"
  },
  "businessType": "Florist",
  "priceCurrency": "IRR",
  "ogImage": "/hero-florist-studio.webp",
  "address": {
    "locality": "Tehran",
    "country": "IR"
  },
  "contact": {
    "mobilePhone": "0912-9333034",
    "officePhone": "021-22011507",
    "email": "contact@houshang-flowers.com",
    "hoursOpen": "08:00",
    "hoursClose": "21:00",
    "mapQuery": "35.772123240655716,51.420586774090964"
  },
  "social": {
    "whatsappPhone": "+989129333034",
    "telegramUsername": "houshangflowers",
    "instagramUsername": "houshangflower"
  },
  "checkout": {
    "shippingFee": 10,
    "taxRate": 0.1
  },
  "currency": {
    "code": "IRR",
    "label": {
      "fa": "تومان",
      "en": "IRR"
    }
  },
  "trustSeal": {
    "id": "5767588",
    "code": "a0tdleVtDMJCDPR9WxSCD59wOLhHcUyO"
  }
}
